paper_id,title,first_author,publication_year,journal,doi,abstract_or_summary,source_api,is_open_access,has_abstract,has_fulltext,document_type,retrieval_query,retrieval_date,screening_status,screening_notes,normalized_title,dedup_key_doi,dedup_key_title_year,duplicate_resolution_basis,master_screening_bucket,non_target_flag,journal_impact_factor_year,journal_impact_factor,journal_quartile,journal_metrics_source,journal_metrics_notes,needs_manual_journal_check
paper_0138,Ni-Based Catalysts for Low Temperature Methane Steam Reforming: Recent Results on Ni-Au and Comparison with Other Bi-Metallic Systems,Hongjing Wu,2013.0,Catalysts,10.3390/catal3020563,"Steam reforming of light hydrocarbons provides a promising method for hydrogen production. Ni-based catalysts are so far the best and the most commonly used catalysts for steam reforming because of their acceptably high activity and significantly lower cost in comparison with alternative precious metal-based catalysts. However, nickel catalysts are susceptible to deactivation from the deposition of carbon, even when operating at steam-to-carbon ratios predicted to be thermodynamically outside of the carbon-forming regime. Reactivity and deactivation by carbon formation can be tuned by modifying Ni surfaces with a second metal, such as Au through alloy formation. In the present review, we summarize the very recent progress in the design, synthesis, and characterization of supported bimetallic Ni-based catalysts for steam reforming. The progress in the modification of Ni with noble metals (such as Au and Ag) is discussed in terms of preparation, characterization and pretreatment methods. Moreover, the comparison with the effects of other metals (such as Sn, Cu, Co, Mo, Fe, Gd and B) is addressed. The differences of catalytic activity, thermal stability and carbon species between bimetallic and monometallic Ni-based catalysts are also briefly shown.",openalex,yes,yes,yes,journal_article,Ni-based steam reforming of methane catalyst || methane steam reforming catalyst,2026-04-24,pending_manual_screen,journal_article_candidate_after_auto_screening,ni based catalysts for low temperature methane steam reforming recent results on ni au and comparison with other bi metallic systems,10.3390/catal3020563,ni based catalysts for low temperature methane steam reforming recent results on ni au and comparison with other bi metallic systems::2013.0,,candidate,no,2024,4.0,Q2,manual_lookup,Official MDPI journal metrics page surfaced via search on 2026-04-27; Impact Factor 4.0 in 2024; Q2 in Chemistry Physical; https://www.mdpi.com/journal/catalysts,no
paper_0139,Stable hydrogen production by methane steam reforming in a two zone fluidized bed reactor: Experimental assessment,Lucía C. Pérez-Moreno,2013.0,Journal of Power Sources,10.1016/j.jpowsour.2013.05.197,,openalex,no,no,yes,journal_article,SRM catalyst methane,2026-04-24,pending_manual_screen,journal_article_candidate_after_auto_screening,stable hydrogen production by methane steam reforming in a two zone fluidized bed reactor experimental assessment,10.1016/j.jpowsour.2013.05.197,stable hydrogen production by methane steam reforming in a two zone fluidized bed reactor experimental assessment::2013.0,,candidate,no,2025,7.9,,manual_lookup,Official ScienceDirect journal homepage surfaced via search on 2026-04-27; https://www.sciencedirect.com/journal/journal-of-power-sources,no
paper_0126,Catalytic partial oxidation and steam reforming of methane on La2O3–Al2O3 supported Pt catalysts as observed by X-ray absorption spectroscopy,Kleper de Oliveira Rocha,2012.0,Applied Catalysis A General,10.1016/j.apcata.2012.04.022,,openalex,no,no,yes,journal_article,SRM catalyst methane,2026-04-24,pending_manual_screen,journal_article_candidate_after_auto_screening,catalytic partial oxidation and steam reforming of methane on la2o3 al2o3 supported pt catalysts as observed by x ray absorption spectroscopy,10.1016/j.apcata.2012.04.022,catalytic partial oxidation and steam reforming of methane on la2o3 al2o3 supported pt catalysts as observed by x ray absorption spectroscopy::2012.0,,non_target_flagged,yes,2025,4.8,,manual_lookup,Official ScienceDirect journal homepage surfaced via search on 2026-04-27; https://www.sciencedirect.com/journal/applied-catalysis-a-general,no
paper_0127,Evaluation of the economic and environmental impact of combining dry reforming with steam reforming of methane,Preeti Gangadharan,2012.0,Process Safety and Environmental Protection,10.1016/j.cherd.2012.04.008,,openalex,no,no,yes,journal_article,steam reforming of methane,2026-04-24,pending_manual_screen,journal_article_candidate_after_auto_screening,evaluation of the economic and environmental impact of combining dry reforming with steam reforming of methane,10.1016/j.cherd.2012.04.008,evaluation of the economic and environmental impact of combining dry reforming with steam reforming of methane::2012.0,,non_target_flagged,yes,2025,7.8,,manual_lookup,Official ScienceDirect journal homepage surfaced via search on 2026-04-27; https://www.sciencedirect.com/journal/process-safety-and-environmental-protection,no
paper_0128,Perovskite NaCeTi<sub>2</sub>O<sub>6</sub>‐Supported Ni Catalysts for CH<sub>4</sub> Steam Reforming,Shenghong Zhang,2012.0,ChemCatChem,10.1002/cctc.201200239,"Abstract Perovskite NaCeTi 2 O 6 (NCT)‐supported Ni catalysts were prepared and examined for the steam reforming of methane (SRM) with a low H 2 O/CH 4 ratio (1:1), and their structures were characterized by means of powder XRD, energy dispersive X‐ray spectroscopy high resolution TEM, temperature‐programmed desorption of CO 2 , temperature‐programmed reduction with H 2 , Ni K‐edge/Ce L III ‐edge X‐ray absorption near edge structure spectroscopy and extended X‐ray absorption fine structure . A 4 wt % Ni/NCT catalyst exhibited higher activity than 4 wt % Ni/TiO 2 , Ni/(CeO 2 +TiO 2 ), and Ni/Ce 2 O 3 catalysts for SRM reactions at 973 K, and better resistance to carbon deposition was observed on 4 wt % Ni/NCT compared to 4 wt % Ni/CeO 2 . It is suggested that the characteristic performance of the Ni/NCT catalysts for the SRM reactions are related to the basic character and oxygen conducting behavior of NCT to control the balance of CH 4 decomposition and carbon gasification with steam on the surfaces of the Ni/NCT catalysts.",openalex,no,yes,yes,journal_article,SRM catalyst methane,2026-04-24,pending_manual_screen,journal_article_candidate_after_auto_screening,perovskite naceti sub 2 sub o sub 6 sub supported ni catalysts for ch sub 4 sub steam reforming,10.1002/cctc.201200239,perovskite naceti sub 2 sub o sub 6 sub supported ni catalysts for ch sub 4 sub steam reforming::2012.0,,candidate,no,,,,,,yes
paper_0129,Production of hydrogen by steam reforming of methane over alumina supported nano-NiO/SiO2 catalyst,Barnali Bej,2012.0,Catalysis Today,10.1016/j.cattod.2012.04.011,,openalex,no,no,yes,journal_article,SRM catalyst methane || methane steam reforming catalyst || steam reforming of methane,2026-04-24,pending_manual_screen,journal_article_candidate_after_auto_screening,production of hydrogen by steam reforming of methane over alumina supported nano nio sio2 catalyst,10.1016/j.cattod.2012.04.011,production of hydrogen by steam reforming of methane over alumina supported nano nio sio2 catalyst::2012.0,,candidate,no,2025,5.3,,manual_lookup,Official ScienceDirect journal homepage surfaced via search on 2026-04-27; https://www.sciencedirect.com/journal/catalysis-today,no
paper_0130,Steam reforming of methane in a bench-scale membrane reactor at realistic working conditions,M. Šarić,2012.0,Catalysis Today,10.1016/j.cattod.2012.04.009,,openalex,no,no,yes,journal_article,steam reforming of methane,2026-04-24,pending_manual_screen,journal_article_candidate_after_auto_screening,steam reforming of methane in a bench scale membrane reactor at realistic working conditions,10.1016/j.cattod.2012.04.009,steam reforming of methane in a bench scale membrane reactor at realistic working conditions::2012.0,,candidate,no,2025,5.3,,manual_lookup,Official ScienceDirect journal homepage surfaced via search on 2026-04-27; https://www.sciencedirect.com/journal/catalysis-today,no
paper_0111,Carbon formation and steam reforming of methane on silica supported nickel catalysts,Xueyan Guo,2011.0,Catalysis Communications,10.1016/j.catcom.2011.12.031,,openalex,no,no,yes,journal_article,methane steam reforming catalyst || steam reforming of methane,2026-04-24,pending_manual_screen,journal_article_candidate_after_auto_screening,carbon formation and steam reforming of methane on silica supported nickel catalysts,10.1016/j.catcom.2011.12.031,carbon formation and steam reforming of methane on silica supported nickel catalysts::2011.0,,candidate,no,,,,,,yes
paper_0112,Hydrogen production from methane and natural gas steam reforming in conventional and microreactor reaction systems,Urko Izquierdo,2011.0,International Journal of Hydrogen Energy,10.1016/j.ijhydene.2011.11.048,,openalex,no,no,yes,journal_article,Ni-based steam reforming of methane catalyst,2026-04-24,pending_manual_screen,journal_article_candidate_after_auto_screening,hydrogen production from methane and natural gas steam reforming in conventional and microreactor reaction systems,10.1016/j.ijhydene.2011.11.048,hydrogen production from methane and natural gas steam reforming in conventional and microreactor reaction systems::2011.0,,candidate,no,2025,8.3,,manual_lookup,Official ScienceDirect journal homepage surfaced via search on 2026-04-27; https://www.sciencedirect.com/journal/international-journal-of-hydrogen-energy,no
paper_0113,Low temperature steam reforming of methane over Ni–Ce(1−)Zr()O2 catalysts under severe conditions,Hyun‐Seog Roh,2011.0,Renewable Energy,10.1016/j.renene.2011.08.013,,openalex,no,no,yes,journal_article,Ni-based steam reforming of methane catalyst || SRM catalyst methane || methane steam reforming catalyst || steam reforming of methane,2026-04-24,pending_manual_screen,journal_article_candidate_after_auto_screening,low temperature steam reforming of methane over ni ce 1 zr o2 catalysts under severe conditions,10.1016/j.renene.2011.08.013,low temperature steam reforming of methane over ni ce 1 zr o2 catalysts under severe conditions::2011.0,,candidate,no,,,,,,yes
paper_0114,Low temperature steam reforming of methane over metal catalyst supported on CexZr1−xO2 in an electric field,Yasushi Sekine,2011.0,Catalysis Today,10.1016/j.cattod.2011.03.076,,openalex,no,no,yes,journal_article,methane steam reforming catalyst || steam reforming of methane,2026-04-24,pending_manual_screen,journal_article_candidate_after_auto_screening,low temperature steam reforming of methane over metal catalyst supported on cexzr1 xo2 in an electric field,10.1016/j.cattod.2011.03.076,low temperature steam reforming of methane over metal catalyst supported on cexzr1 xo2 in an electric field::2011.0,,candidate,no,2025,5.3,,manual_lookup,Official ScienceDirect journal homepage surfaced via search on 2026-04-27; https://www.sciencedirect.com/journal/catalysis-today,no
paper_0115,Methane Steam Reforming Over Ni/NiAl2O4 Catalyst: The Effect of Steam-to-Methane Ratio,Sprung,2011.0,Topics in Catalysis,10.1007/s11244-011-9726-6,,crossref,unclear,no,yes,journal_article,Ni-based steam reforming of methane catalyst || methane steam reforming catalyst || steam reforming of methane,2026-04-24,pending_manual_screen,journal_article_candidate_after_auto_screening,methane steam reforming over ni nial2o4 catalyst the effect of steam to methane ratio,10.1007/s11244-011-9726-6,methane steam reforming over ni nial2o4 catalyst the effect of steam to methane ratio::2011.0,,candidate,no,,,,,,yes
paper_0116,Methane Steam Reforming Reaction Behaviour in a Packed Bed Membrane Reactor,Chibane,2011.0,International Journal of Chemical Engineering and Applications,10.7763/ijcea.2011.v2.93,,crossref,unclear,no,no,journal_article,methane steam reforming catalyst || steam reforming of methane,2026-04-24,pending_manual_screen,journal_article_candidate_after_auto_screening,methane steam reforming reaction behaviour in a packed bed membrane reactor,10.7763/ijcea.2011.v2.93,methane steam reforming reaction behaviour in a packed bed membrane reactor::2011.0,,candidate,no,,,,,,yes
paper_0117,Optimizing the catalyst distribution for countercurrent methane steam reforming in plate reactors,Zanfir,2011.0,AIChE Journal,10.1002/aic.12474,"Abstract Microscale autothermal reactors remain one of the most promising technologies for efficient hydrogen generation. The typical reactor design alternates microchannels where reforming and catalytic combustion of methane occur, so that exothermic and endothermic reactions take place in close proximity. The influence of flow arrangement on the autothermal coupling of methane steam reforming and methane catalytic combustion in catalytic plate reactors is investigated. The reactor thermal behavior and performance for cocurrent and countercurrent are simulated and compared. A partial overlapping of the catalyst zones in adjacent exothermic and endothermic channels is shown to avoid both severe temperature excursions and reactor extinction. Using an innovative, optimization‐based approach for determining the catalyst zone overlap, a solution is provided to the problem of determining the maximum reactor conversion within specified temperature bounds, designed to preserve reactor integrity and operational safety. © 2010 American Institute of Chemical Engineers AIChE J, 2011",crossref,unclear,yes,yes,journal_article,methane steam reforming catalyst,2026-04-24,pending_manual_screen,journal_article_candidate_after_auto_screening,optimizing the catalyst distribution for countercurrent methane steam reforming in plate reactors,10.1002/aic.12474,optimizing the catalyst distribution for countercurrent methane steam reforming in plate reactors::2011.0,,non_target_flagged,yes,,,,,,yes
paper_0118,Pilot Study on the Use of Methane Steam Reforming Catalyst in Molten Car-bonate Fuel Cell,LI,2011.0,CHINESE JOURNAL OF CATALYSIS (CHINESE VERSION),10.3724/sp.j.1088.2011.00637,,crossref,unclear,no,yes,journal_article,methane steam reforming catalyst,2026-04-24,pending_manual_screen,journal_article_candidate_after_auto_screening,pilot study on the use of methane steam reforming catalyst in molten car bonate fuel cell,10.3724/sp.j.1088.2011.00637,pilot study on the use of methane steam reforming catalyst in molten car bonate fuel cell::2011.0,,candidate,no,,,,,,yes
paper_0119,Progresses in the Preparation of Coke Resistant Ni‐based Catalyst for Steam and CO<sub>2</sub> Reforming of Methane,Changjun Liu,2011.0,ChemCatChem,10.1002/cctc.201000358,"Abstract Steam reforming of methane is an extremely important process for the hydrogen and syngas production. Nickel‐based catalysts have been extensively employed in the industrial process of steam reforming because of their high activity, low cost, and the plentiful supply of Nickel. Nickel‐based catalysts have also shown high activity for CO 2 reforming of methane, which has been considered as a good option, with consumption of a significant amount of carbon dioxide. However, a major challenge is that Ni catalysts have a high thermodynamic potential for coke formation during reforming reactions. For steam reforming, coke formation induces deactivation of the catalyst, especially if the carbon forms as carbon filaments. The filamentous carbon material has a high mechanical strength and can cause mechanical deformation of the catalyst. For CO 2 reforming, coke formation over Ni catalyst is even more serious and leads to rapid deactivation of the catalyst. It is highly desired to design and synthesize a coke resistant Ni catalyst not only for reforming of methane, but also for reforming of other hydrocarbons (including biomass derived hydrocarbons). Herein we summarize the very recent progresses in the design, synthesis, and characterization of coke resistant Ni catalysts for steam and CO 2 reforming of methane. The progresses in the use of promoters, in the effect of supporting materials and in the preparation methods have been discussed. The thermal stability, regeneration, and future development of coke resistant Ni catalysts for these processes are also briefly addressed.",openalex,no,yes,yes,journal_article,Ni-based steam reforming of methane catalyst || methane steam reforming catalyst || steam reforming of methane,2026-04-24,pending_manual_screen,journal_article_candidate_after_auto_screening,progresses in the preparation of coke resistant ni based catalyst for steam and co sub 2 sub reforming of methane,10.1002/cctc.201000358,progresses in the preparation of coke resistant ni based catalyst for steam and co sub 2 sub reforming of methane::2011.0,,candidate,no,,,,,,yes
paper_0120,Ru/Ni/MgAl2O4 catalysts for steam reforming of methane: effects of Ru content on self-activation property,Seung-Chan Baek,2011.0,Research on Chemical Intermediates,10.1007/s11164-011-0462-0,,openalex,no,no,yes,journal_article,SRM catalyst methane,2026-04-24,pending_manual_screen,journal_article_candidate_after_auto_screening,ru ni mgal2o4 catalysts for steam reforming of methane effects of ru content on self activation property,10.1007/s11164-011-0462-0,ru ni mgal2o4 catalysts for steam reforming of methane effects of ru content on self activation property::2011.0,,candidate,no,,,,,,yes
paper_0121,Steam Reforming of Methane Over Nickel: Development of a Multi-Step Surface Reaction Mechanism,Lubow Maier,2011.0,Topics in Catalysis,10.1007/s11244-011-9702-1,,openalex,no,no,yes,journal_article,Ni-based steam reforming of methane catalyst || steam reforming of methane,2026-04-24,pending_manual_screen,journal_article_candidate_after_auto_screening,steam reforming of methane over nickel development of a multi step surface reaction mechanism,10.1007/s11244-011-9702-1,steam reforming of methane over nickel development of a multi step surface reaction mechanism::2011.0,,candidate,no,,,,,,yes
paper_0122,Steam reforming of methane over Ni catalyst in micro-channel reactor,Xuli Zhai,2011.0,International Journal of Hydrogen Energy,10.1016/j.ijhydene.2011.03.065,,openalex,no,no,yes,journal_article,SRM catalyst methane || methane steam reforming catalyst || steam reforming of methane,2026-04-24,pending_manual_screen,journal_article_candidate_after_auto_screening,steam reforming of methane over ni catalyst in micro channel reactor,10.1016/j.ijhydene.2011.03.065,steam reforming of methane over ni catalyst in micro channel reactor::2011.0,,candidate,no,2025,8.3,,manual_lookup,Official ScienceDirect journal homepage surfaced via search on 2026-04-27; https://www.sciencedirect.com/journal/international-journal-of-hydrogen-energy,no
paper_0123,Steam reforming of methane to syngas over NiAl2O4 spinel catalysts,N. Salhi,2011.0,International Journal of Hydrogen Energy,10.1016/j.ijhydene.2010.11.071,,openalex,no,no,yes,journal_article,methane steam reforming catalyst || steam reforming of methane,2026-04-24,pending_manual_screen,journal_article_candidate_after_auto_screening,steam reforming of methane to syngas over nial2o4 spinel catalysts,10.1016/j.ijhydene.2010.11.071,steam reforming of methane to syngas over nial2o4 spinel catalysts::2011.0,,candidate,no,2025,8.3,,manual_lookup,Official ScienceDirect journal homepage surfaced via search on 2026-04-27; https://www.sciencedirect.com/journal/international-journal-of-hydrogen-energy,no
paper_0124,Thermal and hydrothermal stability of a metal monolithic anodic alumina support for steam reforming of methane,Yu Guo,2011.0,Chemical Engineering Journal,10.1016/j.cej.2011.01.036,,openalex,no,no,yes,journal_article,SRM catalyst methane,2026-04-24,pending_manual_screen,journal_article_candidate_after_auto_screening,thermal and hydrothermal stability of a metal monolithic anodic alumina support for steam reforming of methane,10.1016/j.cej.2011.01.036,thermal and hydrothermal stability of a metal monolithic anodic alumina support for steam reforming of methane::2011.0,,candidate,no,2025,13.2,,manual_lookup,Official ScienceDirect journal homepage surfaced via search on 2026-04-27; https://www.sciencedirect.com/journal/chemical-engineering-journal,no
paper_0125,Thermodynamic and experimental study of combined dry and steam reforming of methane on Ru/ ZrO2-La2O3 catalyst at low temperature,M.A. Soria,2011.0,International Journal of Hydrogen Energy,10.1016/j.ijhydene.2011.08.117,,openalex,no,no,yes,journal_article,methane steam reforming catalyst || steam reforming of methane,2026-04-24,pending_manual_screen,journal_article_candidate_after_auto_screening,thermodynamic and experimental study of combined dry and steam reforming of methane on ru zro2 la2o3 catalyst at low temperature,10.1016/j.ijhydene.2011.08.117,thermodynamic and experimental study of combined dry and steam reforming of methane on ru zro2 la2o3 catalyst at low temperature::2011.0,,candidate,no,2025,8.3,,manual_lookup,Official ScienceDirect journal homepage surfaced via search on 2026-04-27; https://www.sciencedirect.com/journal/international-journal-of-hydrogen-energy,no
paper_0098,CFD simulation with detailed chemistry of steam reforming of methane for hydrogen production in an integrated micro-reactor,Xuli Zhai,2010.0,International Journal of Hydrogen Energy,10.1016/j.ijhydene.2010.03.034,,openalex,no,no,yes,journal_article,SRM catalyst methane || steam reforming of methane,2026-04-24,pending_manual_screen,journal_article_candidate_after_auto_screening,cfd simulation with detailed chemistry of steam reforming of methane for hydrogen production in an integrated micro reactor,10.1016/j.ijhydene.2010.03.034,cfd simulation with detailed chemistry of steam reforming of methane for hydrogen production in an integrated micro reactor::2010.0,,candidate,no,2025,8.3,,manual_lookup,Official ScienceDirect journal homepage surfaced via search on 2026-04-27; https://www.sciencedirect.com/journal/international-journal-of-hydrogen-energy,no
paper_0099,Catalytic performance of Ni catalysts for steam reforming of methane at high space velocity,Xuli Zhai,2010.0,International Journal of Hydrogen Energy,10.1016/j.ijhydene.2010.10.053,,openalex,no,no,yes,journal_article,Ni-based steam reforming of methane catalyst || SRM catalyst methane || methane steam reforming catalyst || steam reforming of methane,2026-04-24,pending_manual_screen,journal_article_candidate_after_auto_screening,catalytic performance of ni catalysts for steam reforming of methane at high space velocity,10.1016/j.ijhydene.2010.10.053,catalytic performance of ni catalysts for steam reforming of methane at high space velocity::2010.0,,candidate,no,2025,8.3,,manual_lookup,Official ScienceDirect journal homepage surfaced via search on 2026-04-27; https://www.sciencedirect.com/journal/international-journal-of-hydrogen-energy,no
paper_0100,"Designing Pt nanoparticles supported on CeO2–Al2O3: Synthesis, characterization and catalytic properties in the steam reforming and partial oxidation of methane",P.J.S. Prieto,2010.0,Journal of Catalysis,10.1016/j.jcat.2010.09.025,,openalex,no,no,yes,journal_article,SRM catalyst methane,2026-04-24,pending_manual_screen,journal_article_candidate_after_auto_screening,designing pt nanoparticles supported on ceo2 al2o3 synthesis characterization and catalytic properties in the steam reforming and partial oxidation of methane,10.1016/j.jcat.2010.09.025,designing pt nanoparticles supported on ceo2 al2o3 synthesis characterization and catalytic properties in the steam reforming and partial oxidation of methane::2010.0,,non_target_flagged,yes,2025,6.5,,manual_lookup,Official ScienceDirect journal homepage surfaced via search on 2026-04-27; https://www.sciencedirect.com/journal/journal-of-catalysis,no
paper_0101,Effect of nickel nano-particle sintering on methane reforming activity of Ni-CGO cermet anodes for internal steam reforming SOFCs,D. Hari Prasad,2010.0,Applied Catalysis B: Environmental,10.1016/j.apcatb.2010.10.026,,openalex,no,no,yes,journal_article,SRM catalyst methane,2026-04-24,pending_manual_screen,journal_article_candidate_after_auto_screening,effect of nickel nano particle sintering on methane reforming activity of ni cgo cermet anodes for internal steam reforming sofcs,10.1016/j.apcatb.2010.10.026,effect of nickel nano particle sintering on methane reforming activity of ni cgo cermet anodes for internal steam reforming sofcs::2010.0,,candidate,no,2025,21.1,,manual_lookup,Current official ScienceDirect journal title is Applied Catalysis B: Environment and Energy; metric captured on 2026-04-27; https://www.sciencedirect.com/journal/applied-catalysis-b-environment-and-energy,no
