paper_id,title,first_author,publication_year,journal,doi,abstract_or_summary,source_api,is_open_access,has_abstract,has_fulltext,document_type,retrieval_query,retrieval_date,screening_status,screening_notes,normalized_title,dedup_key_doi,dedup_key_title_year,duplicate_resolution_basis,master_screening_bucket,non_target_flag,journal_impact_factor_year,journal_impact_factor,journal_quartile,journal_metrics_source,journal_metrics_notes,needs_manual_journal_check
paper_0179,Hydrogen Production via Low-Temperature Steam–Methane Reforming Using Ni–CeO<sub>2</sub>–Al<sub>2</sub>O<sub>3</sub> Hybrid Nanoparticle Clusters as Catalysts,Guan-Hung Lai,2019.0,ACS Applied Energy Materials,10.1021/acsaem.9b01444,"The hybrid nanostructures, Ni-only and Ni–CeO2 nanoparticles decorated on Al2O3 nanoparticle clusters (Ni–Al2O3 NPC and Ni–CeO2–Al2O3 NPC, respectively), were successfully synthesized as catalysts for steam reforming of methane (SRM). A substantial amount of metal–support interface was created in the hybrid nanostructure via aerosol-based evaporation-induced self-assembly, by which ultrafine Ni crystallites (≈6 nm) and tunable chemical composition achieved simultaneously. Addition of Al2O3 NPC increased metal surface area and also suppressed Ni sintering in the hybrid nanostructure during catalysis. Hybridization with CeO2 nanoparticles significantly improved catalytic activity and stability of the Ni-based catalyst, especially in the absence of Al2O3 NPC, and the amount of coke formation was shown to be effectively suppressed by >3×. A superior high catalytic performance of the hybrid nanostructures achieved: a low starting temperature (400 °C), remarkable activity at low temperature (turnover frequencies of methane conversion of 0.8 s–1 at 500 °C), ideal H2 yield (≈3× of the converted methane), and high operation stability over 8 h reaction. The work demonstrates a prototype study of gas-phase synthesis of hybrid nanocatalysts using Al2O3 NPC as the support matrix to achieve a very high activity at a low-temperature operation of SRM, which has shown promise for an advance of methane-based energy applications.",openalex,no,yes,yes,journal_article,SRM catalyst methane,2026-04-24,pending_manual_screen,journal_article_candidate_after_auto_screening,hydrogen production via low temperature steam methane reforming using ni ceo sub 2 sub al sub 2 sub o sub 3 sub hybrid nanoparticle clusters as catalysts,10.1021/acsaem.9b01444,hydrogen production via low temperature steam methane reforming using ni ceo sub 2 sub al sub 2 sub o sub 3 sub hybrid nanoparticle clusters as catalysts::2019.0,,candidate,no,2025,5.6,,manual_lookup,Official ACS journal about page surfaced via search on 2026-04-27; https://pubs.acs.org/page/aaemcq/about.html,no
paper_0180,Hydrogen production by steam reforming of methane over nickel based structured catalysts supported on calcium aluminate modified SiC,Young Su Noh,2019.0,International Journal of Hydrogen Energy,10.1016/j.ijhydene.2019.04.287,,openalex,no,no,yes,journal_article,SRM catalyst methane,2026-04-24,pending_manual_screen,journal_article_candidate_after_auto_screening,hydrogen production by steam reforming of methane over nickel based structured catalysts supported on calcium aluminate modified sic,10.1016/j.ijhydene.2019.04.287,hydrogen production by steam reforming of methane over nickel based structured catalysts supported on calcium aluminate modified sic::2019.0,,candidate,no,2025,8.3,,manual_lookup,Official ScienceDirect journal homepage surfaced via search on 2026-04-27; https://www.sciencedirect.com/journal/international-journal-of-hydrogen-energy,no
paper_0181,Influence of the preparation method in the metal-support interaction and reducibility of Ni-Mg-Al based catalysts for methane steam reforming,Lola Azancot,2019.0,International Journal of Hydrogen Energy,10.1016/j.ijhydene.2019.05.167,,openalex,yes,no,yes,journal_article,Ni-based steam reforming of methane catalyst,2026-04-24,pending_manual_screen,journal_article_candidate_after_auto_screening,influence of the preparation method in the metal support interaction and reducibility of ni mg al based catalysts for methane steam reforming,10.1016/j.ijhydene.2019.05.167,influence of the preparation method in the metal support interaction and reducibility of ni mg al based catalysts for methane steam reforming::2019.0,,candidate,no,2025,8.3,,manual_lookup,Official ScienceDirect journal homepage surfaced via search on 2026-04-27; https://www.sciencedirect.com/journal/international-journal-of-hydrogen-energy,no
paper_0182,La-doped supported Ni catalysts for steam reforming of methane,Meriem Boudjeloud,2019.0,International Journal of Hydrogen Energy,10.1016/j.ijhydene.2019.01.140,,openalex,no,no,yes,journal_article,methane steam reforming catalyst || steam reforming of methane,2026-04-24,pending_manual_screen,journal_article_candidate_after_auto_screening,la doped supported ni catalysts for steam reforming of methane,10.1016/j.ijhydene.2019.01.140,la doped supported ni catalysts for steam reforming of methane::2019.0,,candidate,no,2025,8.3,,manual_lookup,Official ScienceDirect journal homepage surfaced via search on 2026-04-27; https://www.sciencedirect.com/journal/international-journal-of-hydrogen-energy,no
paper_0183,The role of Pt loading on La2O3-Al2O3 support for methane conversion reactions via partial oxidation and steam reforming,Jesuina C.S. Araújo,2019.0,Fuel,10.1016/j.fuel.2019.115681,,openalex,no,no,yes,journal_article,SRM catalyst methane,2026-04-24,pending_manual_screen,journal_article_candidate_after_auto_screening,the role of pt loading on la2o3 al2o3 support for methane conversion reactions via partial oxidation and steam reforming,10.1016/j.fuel.2019.115681,the role of pt loading on la2o3 al2o3 support for methane conversion reactions via partial oxidation and steam reforming::2019.0,,non_target_flagged,yes,2025,7.5,,manual_lookup,Official ScienceDirect journal homepage surfaced via search on 2026-04-27; https://www.sciencedirect.com/journal/fuel,no
paper_0184,Upgrading existing gas-steam combined cycle power plants through steam injection and methane steam reforming,Carapellucci,2019.0,Energy,10.1016/j.energy.2019.02.046,,crossref,unclear,no,yes,journal_article,steam reforming of methane,2026-04-24,pending_manual_screen,journal_article_candidate_after_auto_screening,upgrading existing gas steam combined cycle power plants through steam injection and methane steam reforming,10.1016/j.energy.2019.02.046,upgrading existing gas steam combined cycle power plants through steam injection and methane steam reforming::2019.0,,candidate,no,2025,9.4,,manual_lookup,Official ScienceDirect journal homepage surfaced via search on 2026-04-27; https://www.sciencedirect.com/journal/energy,no
paper_0170,Behaviour of Rh supported on hydroxyapatite catalysts in partial oxidation and steam reforming of methane: On the role of the speciation of the Rh particles,Zouhair Boukha,2018.0,Applied Catalysis A General,10.1016/j.apcata.2018.03.002,,openalex,yes,no,yes,journal_article,SRM catalyst methane,2026-04-24,pending_manual_screen,journal_article_candidate_after_auto_screening,behaviour of rh supported on hydroxyapatite catalysts in partial oxidation and steam reforming of methane on the role of the speciation of the rh particles,10.1016/j.apcata.2018.03.002,behaviour of rh supported on hydroxyapatite catalysts in partial oxidation and steam reforming of methane on the role of the speciation of the rh particles::2018.0,,non_target_flagged,yes,2025,4.8,,manual_lookup,Official ScienceDirect journal homepage surfaced via search on 2026-04-27; https://www.sciencedirect.com/journal/applied-catalysis-a-general,no
paper_0171,Dual‐Function Cobalt–Nickel Nanoparticles Tailored for High‐Temperature Induction‐Heated Steam Methane Reforming,Morten G. Vinum,2018.0,Angewandte Chemie International Edition,10.1002/anie.201804832,"Abstract The tailored chemical synthesis of binary and ternary alloy nanoparticles with a uniform elemental composition is presented. Their dual use as magnetic susceptors for induction heating and catalytic agent for steam reforming of methane to produce hydrogen at temperatures near and above 800 °C is demonstrated. The heating and catalytic performance of two chemically synthesized samples of CoNi and Cu ⊂ CoNi are compared and held against a traditional Ni‐based reforming catalyst. The structural, magnetic, and catalytic properties of the samples were characterized by X‐ray diffraction, elemental analysis, magnetometry, and reactivity measurements. For induction‐heated catalysts, the conversion rate of methane is limited by chemical reactivity, as opposed to the case of traditional externally heated reformers where heat transport limitations are the limiting factor. Catalyst production by the synthetic route allows controlled doping with miniscule concentrations of auxiliary metals.",openalex,no,yes,yes,journal_article,Ni-based steam reforming of methane catalyst,2026-04-24,pending_manual_screen,journal_article_candidate_after_auto_screening,dual function cobalt nickel nanoparticles tailored for high temperature induction heated steam methane reforming,10.1002/anie.201804832,dual function cobalt nickel nanoparticles tailored for high temperature induction heated steam methane reforming::2018.0,,candidate,no,,,,,,yes
paper_0172,Monolithic substrate support catalyst design considerations for steam methane reforming operation,Baharudin,2018.0,Reviews in Chemical Engineering,10.1515/revce-2016-0048,"Abstract This paper reviews the research undertaken to study the design criteria that address the monolithic support structure requirements in steam reforming operation for the effective mass transfer of process gases to the active sites and effective conductive heat transfer through tube wall to the active catalytic areas, as well as low pressure drop operation. Design considerations include selection of substrate materials that possess good mechanical strength to withstand the severe reaction conditions and prevent catalyst crushing that would lead to carbon formation and catalyst deactivation, and excessive heating of the tube that results in hot spots which is fatal to tube lifetime. The support’s mechanical properties are listed for the purpose of providing guidelines on verifying the structure durability. The practical aspect of packaging and stacking the monolith structures in the reformer tube for ease of loading and discharge is discussed to understand its readiness in industrial application.",crossref,unclear,yes,yes,review,methane steam reforming catalyst,2026-04-24,pending_manual_screen,review_kept_separately_for_manual_flagging,monolithic substrate support catalyst design considerations for steam methane reforming operation,10.1515/revce-2016-0048,monolithic substrate support catalyst design considerations for steam methane reforming operation::2018.0,,candidate,no,,,,,,yes
paper_0173,Real time optimization of steam reforming of methane in an industrial hydrogen plant,M. Taji,2018.0,International Journal of Hydrogen Energy,10.1016/j.ijhydene.2018.05.094,,openalex,no,no,yes,journal_article,steam reforming of methane,2026-04-24,pending_manual_screen,journal_article_candidate_after_auto_screening,real time optimization of steam reforming of methane in an industrial hydrogen plant,10.1016/j.ijhydene.2018.05.094,real time optimization of steam reforming of methane in an industrial hydrogen plant::2018.0,,candidate,no,2025,8.3,,manual_lookup,Official ScienceDirect journal homepage surfaced via search on 2026-04-27; https://www.sciencedirect.com/journal/international-journal-of-hydrogen-energy,no
paper_0174,Recent Advances in Supported Metal Catalysts for Syngas Production from Methane,Mohanned Mohamedali,2018.0,ChemEngineering,10.3390/chemengineering2010009,"Over the past few years, great attention is paid to syngas production processes from different resources especially from abundant sources, such as methane. This review of the literature is intended for syngas production from methane through the dry reforming (DRM) and the steam reforming of methane (SRM). The catalyst development for DRM and SRM represents the key factor to realize a commercial application through the utilization of more efficient catalytic systems. Due to the enormous amount of published literature in this field, the current work is mainly dedicated to the most recent achievements in the metal-oxide catalyst development for DRM and SRM in the past five years. Ni-based supported catalysts are considered the most widely used catalysts for DRM and SRM, which are commercially available; hence, this review has focused on the recent advancements achieved in Ni catalysts with special focus on the various attempts to address the catalyst deactivation challenge in both DRM and SRM applications. Furthermore, other catalytic systems, including Co-based catalysts, noble metals (Pt, Rh, Ru, and Ir), and bimetallic systems have been included in this literature review to understand the observed improvements in the catalytic activities and coke suppression property of these catalysts.",openalex,yes,yes,yes,journal_article,SRM catalyst methane,2026-04-24,pending_manual_screen,journal_article_candidate_after_auto_screening,recent advances in supported metal catalysts for syngas production from methane,10.3390/chemengineering2010009,recent advances in supported metal catalysts for syngas production from methane::2018.0,,non_target_flagged,yes,,,,,,yes
paper_0165,Catalytic properties of a pure Ni coil catalyst for methane steam reforming,Hirano,2017.0,International Journal of Hydrogen Energy,10.1016/j.ijhydene.2017.10.135,,crossref,unclear,no,yes,journal_article,Ni-based steam reforming of methane catalyst,2026-04-24,pending_manual_screen,journal_article_candidate_after_auto_screening,catalytic properties of a pure ni coil catalyst for methane steam reforming,10.1016/j.ijhydene.2017.10.135,catalytic properties of a pure ni coil catalyst for methane steam reforming::2017.0,,candidate,no,2025,8.3,,manual_lookup,Official ScienceDirect journal homepage surfaced via search on 2026-04-27; https://www.sciencedirect.com/journal/international-journal-of-hydrogen-energy,no
paper_0166,Effect of Pt doping on activity and stability of Ni/MgAl2O4 catalyst for steam reforming of methane at ambient and high pressure condition,Vinod Kumar Jaiswar,2017.0,International Journal of Hydrogen Energy,10.1016/j.ijhydene.2017.06.096,,openalex,no,no,yes,journal_article,steam reforming of methane,2026-04-24,pending_manual_screen,journal_article_candidate_after_auto_screening,effect of pt doping on activity and stability of ni mgal2o4 catalyst for steam reforming of methane at ambient and high pressure condition,10.1016/j.ijhydene.2017.06.096,effect of pt doping on activity and stability of ni mgal2o4 catalyst for steam reforming of methane at ambient and high pressure condition::2017.0,,candidate,no,2025,8.3,,manual_lookup,Official ScienceDirect journal homepage surfaced via search on 2026-04-27; https://www.sciencedirect.com/journal/international-journal-of-hydrogen-energy,no
paper_0167,Innovative catalyst design for methane steam reforming intensification,Ricca,2017.0,Fuel,10.1016/j.fuel.2016.11.006,,crossref,unclear,no,yes,journal_article,methane steam reforming catalyst,2026-04-24,pending_manual_screen,journal_article_candidate_after_auto_screening,innovative catalyst design for methane steam reforming intensification,10.1016/j.fuel.2016.11.006,innovative catalyst design for methane steam reforming intensification::2017.0,,candidate,no,2025,7.5,,manual_lookup,Official ScienceDirect journal homepage surfaced via search on 2026-04-27; https://www.sciencedirect.com/journal/fuel,no
paper_0168,Low temperature steam reforming of methane using metal oxide promoted Ni-Ce0.8Zr0.2O2 catalysts in a compact reformer,Hak-Min Kim,2017.0,International Journal of Hydrogen Energy,10.1016/j.ijhydene.2017.11.058,,openalex,no,no,yes,journal_article,SRM catalyst methane,2026-04-24,pending_manual_screen,journal_article_candidate_after_auto_screening,low temperature steam reforming of methane using metal oxide promoted ni ce0 8zr0 2o2 catalysts in a compact reformer,10.1016/j.ijhydene.2017.11.058,low temperature steam reforming of methane using metal oxide promoted ni ce0 8zr0 2o2 catalysts in a compact reformer::2017.0,,candidate,no,2025,8.3,,manual_lookup,Official ScienceDirect journal homepage surfaced via search on 2026-04-27; https://www.sciencedirect.com/journal/international-journal-of-hydrogen-energy,no
paper_0169,Methane dissociative adsorption in catalytic steam reforming of methane over Pd/CeO2 in an electric field,Satoshi Okada,2017.0,Catalysis Today,10.1016/j.cattod.2017.05.079,,openalex,no,no,yes,journal_article,steam reforming of methane,2026-04-24,pending_manual_screen,journal_article_candidate_after_auto_screening,methane dissociative adsorption in catalytic steam reforming of methane over pd ceo2 in an electric field,10.1016/j.cattod.2017.05.079,methane dissociative adsorption in catalytic steam reforming of methane over pd ceo2 in an electric field::2017.0,,candidate,no,2025,5.3,,manual_lookup,Official ScienceDirect journal homepage surfaced via search on 2026-04-27; https://www.sciencedirect.com/journal/catalysis-today,no
paper_0157,Characterization and performance evaluation of Ni-based catalysts with Ce promoter for methane and hydrocarbons steam reforming process,Xia Yang,2016.0,Fuel,10.1016/j.fuel.2016.03.104,,openalex,no,no,yes,journal_article,Ni-based steam reforming of methane catalyst || methane steam reforming catalyst,2026-04-24,pending_manual_screen,journal_article_candidate_after_auto_screening,characterization and performance evaluation of ni based catalysts with ce promoter for methane and hydrocarbons steam reforming process,10.1016/j.fuel.2016.03.104,characterization and performance evaluation of ni based catalysts with ce promoter for methane and hydrocarbons steam reforming process::2016.0,,candidate,no,2025,7.5,,manual_lookup,Official ScienceDirect journal homepage surfaced via search on 2026-04-27; https://www.sciencedirect.com/journal/fuel,no
paper_0158,Differences in the Nature of Active Sites for Methane Dry Reforming and Methane Steam Reforming over Nickel Aluminate Catalysts,Jessica L. Rogers,2016.0,ACS Catalysis,10.1021/acscatal.6b01133,"The Pechini synthesis was used to prepare nickel aluminate catalysts with the compositions NiAl4O7, NiAl2O4, and Ni2Al2O5. The samples have been characterized by N2 physisorption, temperature-programmed reduction (TPR), temperature-programmed oxidation (TPO), X-ray diffraction (XRD), X-ray photoelectron spectroscopy (XPS), transmission electron microscopy (TEM), and X-ray absorption spectroscopy (XAS). Characterization results indicate unique structural properties and excellent regeneration potential of nickel aluminates. Prepared samples were tested when unreduced and reduced prior to reaction for methane dry reforming and methane steam reforming reactivity. NiAl2O4 in the reduced and unreduced state as well as NiAl4O7 in the reduced state are active and stable for methane dry reforming due to the presence of 4-fold coordinated oxidized nickel. The limited amount of metallic nickel in these samples minimizes carbon deposition. On the other hand, the presence of metallic nickel is required for methane steam reforming. Ni2Al2O5 in the reduced and unreduced states and NiAl2O4 in the reduced state are found to be active for methane steam reforming due to the presence of sufficiently small nickel nanoparticles that catalyze the reaction without accumulating carbonaceous deposits.",openalex,yes,yes,yes,journal_article,methane steam reforming catalyst,2026-04-24,pending_manual_screen,journal_article_candidate_after_auto_screening,differences in the nature of active sites for methane dry reforming and methane steam reforming over nickel aluminate catalysts,10.1021/acscatal.6b01133,differences in the nature of active sites for methane dry reforming and methane steam reforming over nickel aluminate catalysts::2016.0,,non_target_flagged,yes,2025,13.1,,manual_lookup,Official ACS journal about page surfaced via search on 2026-04-27; https://pubs.acs.org/page/accacs/about.html,no
paper_0159,Effect of calcination temperature on stability and activity of Ni/MgAl2O4 catalyst for steam reforming of methane at high pressure condition,Sanjay Katheria,2016.0,International Journal of Hydrogen Energy,10.1016/j.ijhydene.2016.05.109,,openalex,no,no,yes,journal_article,methane steam reforming catalyst || steam reforming of methane,2026-04-24,pending_manual_screen,journal_article_candidate_after_auto_screening,effect of calcination temperature on stability and activity of ni mgal2o4 catalyst for steam reforming of methane at high pressure condition,10.1016/j.ijhydene.2016.05.109,effect of calcination temperature on stability and activity of ni mgal2o4 catalyst for steam reforming of methane at high pressure condition::2016.0,,candidate,no,2025,8.3,,manual_lookup,Official ScienceDirect journal homepage surfaced via search on 2026-04-27; https://www.sciencedirect.com/journal/international-journal-of-hydrogen-energy,no
paper_0160,"High catalytic activity and stability of ZnLaAlO4 supported Ni, Pt and Ru nanocatalysts applied in the dry, steam and combined dry-steam reforming of methane",Yasin Khani,2016.0,Chemical Engineering Journal,10.1016/j.cej.2016.04.108,,openalex,no,no,yes,journal_article,SRM catalyst methane || steam reforming of methane,2026-04-24,pending_manual_screen,journal_article_candidate_after_auto_screening,high catalytic activity and stability of znlaalo4 supported ni pt and ru nanocatalysts applied in the dry steam and combined dry steam reforming of methane,10.1016/j.cej.2016.04.108,high catalytic activity and stability of znlaalo4 supported ni pt and ru nanocatalysts applied in the dry steam and combined dry steam reforming of methane::2016.0,,candidate,no,2025,13.2,,manual_lookup,Official ScienceDirect journal homepage surfaced via search on 2026-04-27; https://www.sciencedirect.com/journal/chemical-engineering-journal,no
paper_0161,Kinetic assessment of Ni-based catalysts in low-temperature methane/biogas steam reforming,Luca Turchetti,2016.0,International Journal of Hydrogen Energy,10.1016/j.ijhydene.2016.07.245,,openalex,no,no,yes,journal_article,Ni-based steam reforming of methane catalyst,2026-04-24,pending_manual_screen,journal_article_candidate_after_auto_screening,kinetic assessment of ni based catalysts in low temperature methane biogas steam reforming,10.1016/j.ijhydene.2016.07.245,kinetic assessment of ni based catalysts in low temperature methane biogas steam reforming::2016.0,,candidate,no,2025,8.3,,manual_lookup,Official ScienceDirect journal homepage surfaced via search on 2026-04-27; https://www.sciencedirect.com/journal/international-journal-of-hydrogen-energy,no
paper_0162,Microwave plasma-based method of hydrogen production via combined steam reforming of methane,Dariusz Czylkowski,2016.0,Energy,10.1016/j.energy.2016.07.088,,openalex,no,no,yes,journal_article,steam reforming of methane,2026-04-24,pending_manual_screen,journal_article_candidate_after_auto_screening,microwave plasma based method of hydrogen production via combined steam reforming of methane,10.1016/j.energy.2016.07.088,microwave plasma based method of hydrogen production via combined steam reforming of methane::2016.0,,candidate,no,2025,9.4,,manual_lookup,Official ScienceDirect journal homepage surfaced via search on 2026-04-27; https://www.sciencedirect.com/journal/energy,no
paper_0163,Modelling and simulation in conventional fixed-bed and fixed-bed membrane reactors for the steam reforming of methane,Jornandes Dias da Silva,2016.0,International Journal of Hydrogen Energy,10.1016/j.ijhydene.2016.01.083,,openalex,no,no,yes,journal_article,steam reforming of methane,2026-04-24,pending_manual_screen,journal_article_candidate_after_auto_screening,modelling and simulation in conventional fixed bed and fixed bed membrane reactors for the steam reforming of methane,10.1016/j.ijhydene.2016.01.083,modelling and simulation in conventional fixed bed and fixed bed membrane reactors for the steam reforming of methane::2016.0,,candidate,no,2025,8.3,,manual_lookup,Official ScienceDirect journal homepage surfaced via search on 2026-04-27; https://www.sciencedirect.com/journal/international-journal-of-hydrogen-energy,no
paper_0164,Ni–perovskite interaction and its structural and catalytic consequences in methane steam reforming and methanation reactions,Ramona Thalinger,2016.0,Journal of Catalysis,10.1016/j.jcat.2016.01.020,,openalex,yes,no,yes,journal_article,steam reforming of methane,2026-04-24,pending_manual_screen,journal_article_candidate_after_auto_screening,ni perovskite interaction and its structural and catalytic consequences in methane steam reforming and methanation reactions,10.1016/j.jcat.2016.01.020,ni perovskite interaction and its structural and catalytic consequences in methane steam reforming and methanation reactions::2016.0,,candidate,no,2025,6.5,,manual_lookup,Official ScienceDirect journal homepage surfaced via search on 2026-04-27; https://www.sciencedirect.com/journal/journal-of-catalysis,no
